{
  "events": [
    {
      "accounts_after": {
        "A": {
          "cash": "10000.00000000",
          "equity": "15256.00000000",
          "fees": "0.00000000",
          "inventory": "50"
        },
        "B": {
          "cash": "9508.95000000",
          "equity": "15290.30447500",
          "fees": "0.24552500",
          "inventory": "55"
        }
      },
      "accounts_before": {
        "A": {
          "cash": "10000.00000000",
          "equity": "14920.50000000",
          "fees": "0.00000000",
          "inventory": "50"
        },
        "B": {
          "cash": "10000.00000000",
          "equity": "14920.50000000",
          "fees": "0.00000000",
          "inventory": "50"
        }
      },
      "actions": {
        "A": {
          "effective": {
            "ask": null,
            "bid": {
              "price": "97.96",
              "quantity": "7"
            },
            "decision_seq": 1
          },
          "error": null,
          "submitted": {
            "ask": null,
            "bid": {
              "price": "97.96",
              "quantity": "7"
            },
            "decision_seq": 1
          },
          "valid": true
        },
        "B": {
          "effective": {
            "ask": {
              "price": "98.61",
              "quantity": "10"
            },
            "bid": {
              "price": "98.21",
              "quantity": "10"
            },
            "decision_seq": 1
          },
          "error": null,
          "submitted": {
            "ask": {
              "price": "98.61",
              "quantity": "10"
            },
            "bid": {
              "price": "98.21",
              "quantity": "10"
            },
            "decision_seq": 1
          },
          "valid": true
        }
      },
      "block_seq": 1,
      "cumulative_volume": {
        "A": "0",
        "B": "5"
      },
      "customer_order": {
        "kind": "noise",
        "quantity": "5",
        "reservation_price": "97.34",
        "side": "sell"
      },
      "environment_state_before": {
        "x_cur": "0.3",
        "x_prev": "0.1"
      },
      "event_hash": "441e31011ac9d8f1c2800631cf918b8f28d0d22bed3048d45b072b7614796ca7",
      "fills": [
        {
          "bot_side": "bid",
          "fee": "0.24552500",
          "notional": "491.05000000",
          "player_id": "B",
          "price": "98.21",
          "quantity": "5"
        }
      ],
      "market_signal": "UP",
      "match_id": "demo-SignalFollower-TightSpread",
      "next_reference_price": "105.12",
      "previous_hash": "06d5b2e054090c67199fef95da0a4f3731a3d5bc98593f0fd2a48a2cf68cc646",
      "reference_price": "98.41",
      "schema": "event.v1"
    },
    {
      "accounts_after": {
        "A": {
          "cash": "10000.00000000",
          "equity": "14885.50000000",
          "fees": "0.00000000",
          "inventory": "50"
        },
        "B": {
          "cash": "9824.91000000",
          "equity": "14905.42649500",
          "fees": "0.40350500",
          "inventory": "52"
        }
      },
      "accounts_before": {
        "A": {
          "cash": "10000.00000000",
          "equity": "15256.00000000",
          "fees": "0.00000000",
          "inventory": "50"
        },
        "B": {
          "cash": "9508.95000000",
          "equity": "15290.30447500",
          "fees": "0.24552500",
          "inventory": "55"
        }
      },
      "actions": {
        "A": {
          "effective": {
            "ask": {
              "price": "105.57",
              "quantity": "7"
            },
            "bid": null,
            "decision_seq": 2
          },
          "error": null,
          "submitted": {
            "ask": {
              "price": "105.57",
              "quantity": "7"
            },
            "bid": null,
            "decision_seq": 2
          },
          "valid": true
        },
        "B": {
          "effective": {
            "ask": {
              "price": "105.32",
              "quantity": "10"
            },
            "bid": {
              "price": "104.92",
              "quantity": "10"
            },
            "decision_seq": 2
          },
          "error": null,
          "submitted": {
            "ask": {
              "price": "105.32",
              "quantity": "10"
            },
            "bid": {
              "price": "104.92",
              "quantity": "10"
            },
            "decision_seq": 2
          },
          "valid": true
        }
      },
      "block_seq": 2,
      "cumulative_volume": {
        "A": "0",
        "B": "8"
      },
      "customer_order": {
        "kind": "noise",
        "quantity": "3",
        "reservation_price": "107.23",
        "side": "buy"
      },
      "environment_state_before": {
        "x_cur": "0.904",
        "x_prev": "0.3"
      },
      "event_hash": "f802eee095f9cd26c7cf2ed0873dd9f455d36f3e1163fab55e6030f8a47b80bb",
      "fills": [
        {
          "bot_side": "ask",
          "fee": "0.15798000",
          "notional": "315.96000000",
          "player_id": "B",
          "price": "105.32",
          "quantity": "3"
        }
      ],
      "market_signal": "DOWN",
      "match_id": "demo-SignalFollower-TightSpread",
      "next_reference_price": "97.71",
      "previous_hash": "441e31011ac9d8f1c2800631cf918b8f28d0d22bed3048d45b072b7614796ca7",
      "reference_price": "105.12",
      "schema": "event.v1"
    },
    {
      "accounts_after": {
        "A": {
          "cash": "10000.00000000",
          "equity": "15274.50000000",
          "fees": "0.00000000",
          "inventory": "50"
        },
        "B": {
          "cash": "10510.28000000",
          "equity": "15256.58381000",
          "fees": "0.74619000",
          "inventory": "45"
        }
      },
      "accounts_before": {
        "A": {
          "cash": "10000.00000000",
          "equity": "14885.50000000",
          "fees": "0.00000000",
          "inventory": "50"
        },
        "B": {
          "cash": "9824.91000000",
          "equity": "14905.42649500",
          "fees": "0.40350500",
          "inventory": "52"
        }
      },
      "actions": {
        "A": {
          "effective": {
            "ask": null,
            "bid": {
              "price": "97.26",
              "quantity": "7"
            },
            "decision_seq": 3
          },
          "error": null,
          "submitted": {
            "ask": null,
            "bid": {
              "price": "97.26",
              "quantity": "7"
            },
            "decision_seq": 3
          },
          "valid": true
        },
        "B": {
          "effective": {
            "ask": {
              "price": "97.91",
              "quantity": "10"
            },
            "bid": {
              "price": "97.51",
              "quantity": "10"
            },
            "decision_seq": 3
          },
          "error": null,
          "submitted": {
            "ask": {
              "price": "97.91",
              "quantity": "10"
            },
            "bid": {
              "price": "97.51",
              "quantity": "10"
            },
            "decision_seq": 3
          },
          "valid": true
        }
      },
      "block_seq": 3,
      "cumulative_volume": {
        "A": "0",
        "B": "15"
      },
      "customer_order": {
        "kind": "informed",
        "quantity": "7",
        "reservation_price": "101.21",
        "side": "buy"
      },
      "environment_state_before": {
        "x_cur": "-0.0541024",
        "x_prev": "0.904"
      },
      "event_hash": "44b99f21771e924f32c16b3672c16b7c33690c6fa41b54a3f9572b22d4fd16a2",
      "fills": [
        {
          "bot_side": "ask",
          "fee": "0.34268500",
          "notional": "685.37000000",
          "player_id": "B",
          "price": "97.91",
          "quantity": "7"
        }
      ],
      "market_signal": "UP",
      "match_id": "demo-SignalFollower-TightSpread",
      "next_reference_price": "105.49",
      "previous_hash": "f802eee095f9cd26c7cf2ed0873dd9f455d36f3e1163fab55e6030f8a47b80bb",
      "reference_price": "97.71",
      "schema": "event.v1"
    },
    {
      "accounts_after": {
        "A": {
          "cash": "10000.00000000",
          "equity": "14734.50000000",
          "fees": "0.00000000",
          "inventory": "50"
        },
        "B": {
          "cash": "10721.66000000",
          "equity": "14792.47812000",
          "fees": "0.85188000",
          "inventory": "43"
        }
      },
      "accounts_before": {
        "A": {
          "cash": "10000.00000000",
          "equity": "15274.50000000",
          "fees": "0.00000000",
          "inventory": "50"
        },
        "B": {
          "cash": "10510.28000000",
          "equity": "15256.58381000",
          "fees": "0.74619000",
          "inventory": "45"
        }
      },
      "actions": {
        "A": {
          "effective": {
            "ask": {
              "price": "105.94",
              "quantity": "7"
            },
            "bid": null,
            "decision_seq": 4
          },
          "error": null,
          "submitted": {
            "ask": {
              "price": "105.94",
              "quantity": "7"
            },
            "bid": null,
            "decision_seq": 4
          },
          "valid": true
        },
        "B": {
          "effective": {
            "ask": {
              "price": "105.69",
              "quantity": "10"
            },
            "bid": {
              "price": "105.29",
              "quantity": "10"
            },
            "decision_seq": 4
          },
          "error": null,
          "submitted": {
            "ask": {
              "price": "105.69",
              "quantity": "10"
            },
            "bid": {
              "price": "105.29",
              "quantity": "10"
            },
            "decision_seq": 4